{
  "schema": "rainmojo.tier1.summary/1",
  "mode": "comparison",
  "meta": {
    "skill": "aiso-llmstxt",
    "client": "Demo Aesthetic Clinic",
    "domain": "demo-aesthetic.example.invalid",
    "generated_at": "2026-09-11T15:10:00+07:00",
    "lang": "th",
    "run_id": "20260911-1510"
  },
  "headline": {
    "kicker": "เปรียบเทียบ",
    "title": "ควรลงแรงกับ llms.txt หรือ answer block ก่อน"
  },
  "comparison": {
    "columns": [
      "llms.txt",
      "answer block 40 ถึง 80 คำ"
    ],
    "rows": [
      {
        "label": "หลักฐานว่า AI ใช้จริง",
        "cells": [
          "ต่ำ ไม่มีแพลตฟอร์มหลักยืนยันว่าอ่าน",
          "สูง งานวิจัย GEO วัดผลได้ +28 ถึง +41 เปอร์เซ็นต์"
        ],
        "impact": "low",
        "effort": "low"
      },
      {
        "label": "เวลาทำ",
        "cells": [
          "1 ชั่วโมง สร้างอัตโนมัติได้",
          "2 สัปดาห์ สำหรับ 12 หน้าบริการ"
        ],
        "impact": "high",
        "effort": "medium"
      },
      {
        "label": "ผลต่อคะแนน",
        "cells": [
          "hygiene 3 คะแนนจาก 60 ในแกนกลาง",
          "citability 20 คะแนน และสัญญาณเฉพาะแพลตฟอร์มอีกหลายรายการ"
        ],
        "impact": "high",
        "effort": "medium"
      }
    ],
    "recommendation": "ทำ llms.txt ให้เสร็จใน 1 ชั่วโมงเพราะต้นทุนต่ำ แล้วทุ่มแรงหลักไปที่ answer block บน 12 หน้าบริการ ซึ่งเป็นตัวขับคะแนนจริง"
  },
  "handoff": {
    "tier2_label": "รายงาน llms.txt และ citability ฉบับเต็ม",
    "tier2_path": "clients/demo-aesthetic.example.invalid/reports/seo-audits/demo-aesthetic.example.invalid_aiso-llmstxt_2026-09-11.md"
  },
  "next_steps": [
    {
      "label": "สร้าง llms.txt",
      "prompt": "/rainmojo-so-lite:aiso-llmstxt-lite demo-aesthetic.example.invalid --generate"
    },
    {
      "label": "เขียน answer block",
      "prompt": "/rainmojo-so-lite:aiso-citability-lite demo-aesthetic.example.invalid --rewrite"
    }
  ]
}
