{
  "schema": "rainmojo.tier1.summary/1",
  "mode": "quick_fact",
  "meta": {
    "skill": "aiso-crawlers",
    "client": "Demo Aesthetic Clinic",
    "domain": "demo-aesthetic.example.invalid",
    "generated_at": "2026-09-11T15:10:00+07:00",
    "lang": "th",
    "run_id": "20260911-1510"
  },
  "headline": {
    "kicker": "ตอบสั้น",
    "title": "การบล็อก GPTBot ทำให้หายจาก ChatGPT search ไหม"
  },
  "tldr": [
    "ไม่หาย การมองเห็นบน ChatGPT search ขึ้นกับ OAI-SearchBot ไม่ใช่ GPTBot",
    "GPTBot ใช้เก็บข้อมูลฝึกโมเดลเท่านั้น และแต่ละ user agent ของ OpenAI ตั้งค่าแยกกันได้"
  ],
  "bullets": [
    "อนุญาต OAI-SearchBot และ ChatGPT-User ถ้าต้องการถูกอ้างอิงใน ChatGPT",
    "จะบล็อก GPTBot หรือไม่เป็นการตัดสินใจเรื่องสิทธิ์การฝึกโมเดล ไม่กระทบคะแนน visibility",
    "ตรวจสถานะปัจจุบันได้จาก robots.txt ของเว็บและไฟล์ IP ที่ OpenAI เผยแพร่"
  ],
  "transparency": {
    "sources": [
      "developers.openai.com/api/docs/bots"
    ],
    "guidelines": [
      "OpenAI crawler documentation"
    ]
  },
  "handoff": {
    "tier2_label": "ดูตาราง crawler ทั้ง 38 ตัวในรายงาน",
    "tier2_path": "clients/demo-aesthetic.example.invalid/reports/seo-audits/demo-aesthetic.example.invalid_aiso-crawlers_2026-09-11.md"
  },
  "next_steps": [
    {
      "label": "สร้าง robots.txt แบบ selective",
      "prompt": "/rainmojo-so-lite:aiso-crawlers-lite demo-aesthetic.example.invalid --generate selective"
    },
    {
      "label": "ตรวจความพร้อมทั้ง 10 แพลตฟอร์ม",
      "prompt": "/rainmojo-so-lite:aiso-platform-lite demo-aesthetic.example.invalid"
    }
  ]
}
